Продукт,"Бел, г","Жир, г","Угл, г","Кал, ккал"
Биойогурт Тёма Груша-яблоко,3.2,2.8,11.6,84
Биойогурт Тёма Зеленое яблоко,3.2,2.8,11.7,85
Биойогурт Тёма Лесные ягоды,3.2,2.8,11.5,84
Биойогурт Тёма Шиповник-малина,3.2,2.8,12.0,86
Биокефир Агуша 3.2%,2.7,3.2,4.0,56
Биокефир Тёма детский 3.2%,2.8,3.2,4.1,56
Биолакт Тёма питьевой сладкий,2.8,3.2,8.3,74
Биолакт ФрутоНяня детский сладкий,2.8,3.2,8.2,74
Биолакт ФрутоНяня кисломолочный без сахара,3.1,3.4,4.7,62
Биотворог Тёма c черникой,7.9,4.2,10.3,111
Биотворог Тёма c черносливом,7.9,4.2,10.1,110
Биотворог Тёма классический,9.1,5.0,3.5,95
Биотворог Тёма с абрикосом,7.9,4.2,10.4,111
Биотворог Тёма с яблоком и морковью,7.9,4.2,10.0,109
Бифилайф Ам-Ам Мамина забота Яблоко и Банан,2.9,2.5,10.5,76
Борщик Heinz с говядинкой,11.3,6.7,67.0,374
Вермишелька Heinz звездочки Любопышки,10.3,1.3,78.6,367
Гречневая каша Nestle безмолочная,11.0,3.0,76.5,377
Гречневая каша Nestle безмолочная с черносливом,11.0,3.0,76.5,377
Гречневая каша Nestle молочная,14.0,10.0,66.0,410
Гречневая каша Nestle молочная с курагой,14.0,10.0,66.0,410
Гречневая каша Малютка безмолочная,11.4,2.7,76.3,375
Гречневая каша Малютка молочная с черносливом,12.8,12.4,67.1,431
Гречневая каша ФрутоНяня безмолочная с яблоком,0.7,0.0,15.0,63
Гречневая кашка Heinz грушка абрикос смородинка молочная,12.0,2.9,76.2,379
Гречневая кашка Heinz низкоаллергенная без молока,9.5,1.6,74.0,350
Гречневая кашка ФрутоНяня молочная жидкая с яблоком,2.0,1.9,9.6,62
Зерновая каша Hipp с фруктами,0.8,0.1,15.9,71
Зерновая каша Hipp с яблоками и бананами,0.8,0.1,14.1,64
Йогурт Агуша вязкий с бананом 2.7%,3.0,2.7,12.0,88
Йогурт Агуша детский натуральный 2.9%,3.0,2.9,10.4,80
Йогурт Агуша детский с черносливом 2.6%,2.8,2.6,11.8,82
Йогурт Агуша питьевой натуральный 3.1%,3.2,3.1,3.7,58
Йогурт Агуша питьевой с персиком 2.7%,2.8,2.7,10.7,81
Йогурт Агуша питьевой с черносливом 2.7%,2.8,2.7,10.7,81
Йогурт Здрайверы клубника 2.5%,2.8,2.5,13.3,90
Йогурт Здрайверы мультифрукт 2.5%,2.8,2.5,10.5,76
Йогурт Здрайверы персик-злаки 2.5%,2.8,2.5,14.0,90
Йогурт Здрайверы яблоко-банан 2.5%,2.8,2.5,14.0,90
Йогурт Растишка с бананом и печеньем,3.8,3.0,16.5,108
Йогурт Растишка с земляникой,2.9,1.6,15.6,88
Йогурт Растишка с клубникой и печеньем,3.8,3.0,16.5,108
Йогурт Растишка с лесными ягодами,2.9,1.6,15.6,88
Йогурт Растишка с мякотью вишни,2.9,1.6,15.5,89
Йогурт Растишка с мякотью клубники,2.9,1.6,15.4,88
Йогурт Растишка с мякотью персика и абрикоса,2.9,1.6,15.6,88
Йогурт Растишка с печеньем,2.9,1.6,15.2,86
Йогурт Растишка с черникой,2.9,1.6,15.6,88
Йогуртное пюре Gerber с грушей и бананом,1.0,3.0,11.0,90
Йогуртное пюре Gerber с малиной и черникой,0.8,2.2,12.0,70
Каша 3 злака Nestle молочная с яблоком и грушей,14.0,10.0,67.5,416
Каша 5 злаков Nestle молочная с яблоком и бананом,14.0,10.0,68.0,418
Каша 7 злаков Малютка безмолочная,10.9,2.2,73.2,374
Кашка Ам-Ам Мамина забота молочно-овсяная с клубникой,2.8,2.5,10.0,75
Кефир Агуша 3.2%,2.7,3.2,4.0,56
Кисель ФрутоНяня из клюквы,0.0,0.0,11.0,44
Кисель ФрутоНяня из малины,0.0,0.0,11.5,46
Кисломолочный напиток Агуша Я Сам! Иммунити,2.0,3.4,8.3,72
Коктейль молочный Агуша Я Сам! кукуруза с бананом,2.5,3.0,10.5,85
Коктейль молочный Агуша Я Сам! рис-груша-яблоко,2.6,3.0,9.4,75
Коктейль молочный Агуша Я Сам! с гречкой,2.5,3.0,8.0,75
Коктейль молочный Здрайверы Клубника 3.2%,2.8,3.2,7.5,70
Коктейль молочный Здрайверы Крем-Брюле 3.0%,2.8,2.0,8.5,63
Коктейль молочный Здрайверы Шоколадный 3.0%,2.9,3.0,10.0,81
Коктейль молочный ФрутоНяня клубника-земляника,2.7,2.1,9.0,66
Кукурузная каша Малютка безмолочная,7.0,1.0,84.5,375
Кукурузная кашка Heinz низкоаллергенная без молока,7.8,3.0,80.4,380
Кукурузная кашка Heinz тыква чернослив морковочка молочная,12.9,6.4,71.2,394
Кукурузные палочки ФрутоНяня Яблоко-банан,6.0,0.0,78.0,345
Мини-хлебцы Агуша рисовые Груша,1.4,0.2,19.8,91
Мини-хлебцы Агуша рисовые Ягодное ассорти,1.5,0.2,20.0,92
Многозерновая кашка 5 злаков Heinz без молока,6.9,1.8,83.0,374
Многозерновая кашка Heinz Любопышки банан клубника йогуртная,13.0,10.9,65.0,410
Многозерновая кашка Heinz Любопышки слива абрикос черника молочная,13.0,11.0,66.0,414
Молоко Агуша с витаминами А и С 3.2%,2.9,3.2,4.7,59
Молоко Агуша с лактулозой 2.5%,3.0,3.2,4.5,59
Молоко Агуша Я Сам! Иммунити 2.5%,2.9,2.5,4.8,53
Молоко Тёма детское 3.2%,3.0,3.2,4.7,60
Молоко Тёма детское обогащенное 3.2%,2.9,3.2,4.7,59
Морс Агуша ягодный сбор,0.0,0.0,10.0,42
